{
  "schema_version": 1,
  "policy_id": "life-github-issue-lifecycle-v1",
  "runtime_control_authority": "NONE",
  "scope": "GITHUB_ENGINEERING_VISIBILITY_ONLY",
  "authorized_repository": "KINETIC-DESIGN-CO/Build",
  "registry_path": "governance/work-admissions.json",
  "workflow_path": ".github/workflows/issue-lifecycle.yml",
  "issue_state_source": "AUTHORITATIVE_GITHUB_ISSUE_READBACK",
  "native_close_mode": "COMBINE_LINKED_PR_AUTO_CLOSE_WITH_REPOSITORY_RECONCILIATION",
  "terminal_admission_states": {
    "COMPLETE": "completed",
    "REMOVED": "not_planned"
  },
  "nonterminal_admission_state": "ADMITTED",
  "reconciliation_trigger": "EVERY_PUSH_TO_MAIN_AND_EXPLICIT_WORKFLOW_DISPATCH",
  "reconciliation_rules": [
    "FOR_EACH_REGISTRY_ITEM_WITH_STATE_COMPLETE_OR_REMOVED_READ_GITHUB_ISSUE_STATE",
    "IF_ISSUE_IS_OPEN_CLOSE_WITH_REASON_MAPPED_FROM_ADMISSION_STATE",
    "IF_ISSUE_IS_CLOSED_WITH_DIFFERENT_REASON_SET_REASON_MAPPED_FROM_ADMISSION_STATE",
    "READ_GITHUB_ISSUE_STATE_AFTER_ANY_RECONCILIATION_OPERATION",
    "FAIL_RECONCILIATION_UNLESS_STATE_IS_CLOSED_AND_REASON_MATCHES_ADMISSION_STATE"
  ],
  "terminal_binding": "ADMITTED_ISSUE_SELECTED_WORK_TERMINAL_TRUE_ONLY_IF_ADMISSION_STATE_IS_COMPLETE_OR_REMOVED_AND_GITHUB_ISSUE_CLOSED_STATE_READBACK_IS_VERIFIED_WITH_MAPPED_REASON",
  "redispatch_binding": "TERMINAL_REDISPATCH_MAY_RUN_ONLY_AFTER_TERMINAL_BINDING_IS_TRUE_FOR_THE_COMPLETED_ADMITTED_ISSUE",
  "native_link_rule": "A_DEFAULT_BRANCH_PULL_REQUEST_MAY_USE_A_GITHUB_SUPPORTED_CLOSING_LINK_BUT_NATIVE_CLOSE_DOES_NOT_REPLACE_AUTHORITATIVE_READBACK",
  "failure_rule": "OPEN_OR_UNREADABLE_OR_WRONG_REASON_GITHUB_ISSUE_FOR_TERMINAL_ADMISSION_RETURNS_NONTERMINAL_CLEANUP_STATE",
  "states": [
    "ADMISSION_NONTERMINAL",
    "CLOSE_REQUIRED",
    "REASON_RECONCILIATION_REQUIRED",
    "READBACK_NOT_RUN",
    "VERIFIED_TERMINAL"
  ]
}
